{
  "target": "Document import feature",
  "scope": ["file selection", "text extraction contract", "note creation handoff"],
  "not_scope": ["production deployment", "private storage integration"],
  "purpose": "Evaluate whether a feature claim can rise from design to runtime operation.",
  "claims": [
    {
      "claim_id": "C1",
      "claim_text": "The feature design defines input, output, state, and failure conditions.",
      "evidence_refs": ["E1"],
      "claimed_level": "L10"
    }
  ],
  "srvl_results": {
    "highest_passed_level": "L10",
    "first_blocking_level": "L11",
    "blocking_reason": "Integration boundaries with parser and storage are not yet closed."
  },
  "evidence": [
    {
      "evidence_id": "E1",
      "evidence_class": "D",
      "summary": "Static design artifact with declared input/output and failure conditions."
    }
  ],
  "gate_results": [
    {
      "gate_id": 0,
      "verdict": "PASS",
      "summary": "Target is normalized into a public review packet."
    },
    {
      "gate_id": 1,
      "verdict": "PASS",
      "summary": "Scope and non-scope are declared."
    },
    {
      "gate_id": 2,
      "verdict": "PASS",
      "summary": "The feature claim is represented as a bounded design claim."
    },
    {
      "gate_id": 3,
      "verdict": "PASS",
      "summary": "Design evidence is separated from runtime, verification, and release claims."
    },
    {
      "gate_id": 4,
      "verdict": "PASS",
      "summary": "The design claim is bound to static evidence E1."
    },
    {
      "gate_id": 5,
      "verdict": "PASS",
      "summary": "SRVL level is bounded to design evidence."
    },
    {
      "gate_id": 6,
      "verdict": "HOLD",
      "summary": "Measurement is incomplete until integration and runtime evidence are added."
    },
    {
      "gate_id": 7,
      "verdict": "HOLD",
      "summary": "Boundary and adversarial parser cases are not yet verified."
    },
    {
      "gate_id": 8,
      "verdict": "PASS",
      "summary": "No runtime, verification, purpose, or release overclaim is made."
    },
    {
      "gate_id": 9,
      "verdict": "HOLD",
      "summary": "Next repair is to define integration contract and runtime evidence."
    },
    {
      "gate_id": 10,
      "verdict": "PASS",
      "summary": "The packet uses generic public wording and contains no private implementation detail."
    },
    {
      "gate_id": 11,
      "verdict": "HOLD",
      "summary": "Final verdict is blocked by missing integration evidence."
    }
  ],
  "forbidden_promotion_clean": true,
  "forbidden_promotion_findings": [],
  "redaction_clean": true,
  "redaction_findings": [],
  "required_next_action": "Define integration contract and add runtime evidence before claiming operation.",
  "final_verdict": "HOLD_EXACT_BLOCKER"
}
