{
  "target": "Uncertainty-aware decision method",
  "scope": ["formal definitions", "state distinctions", "counterexample search"],
  "not_scope": ["private implementation", "deployment", "external validation"],
  "purpose": "Evaluate whether a research direction is coherent enough to proceed to semantic binding.",
  "claims": [
    {
      "claim_id": "C1",
      "claim_text": "The method distinguishes known, unknown, impossible, and boundary states.",
      "evidence_refs": ["E1"],
      "claimed_level": "L7"
    }
  ],
  "srvl_results": {
    "highest_passed_level": "L7",
    "first_blocking_level": "L8",
    "blocking_reason": "The state names are not yet bound to observable examples and adversarial semantic cases."
  },
  "evidence": [
    {
      "evidence_id": "E1",
      "evidence_class": "E",
      "summary": "Conceptual definitions and contradiction checks."
    }
  ],
  "gate_results": [
    {
      "gate_id": 1,
      "verdict": "PASS",
      "summary": "Research scope and non-scope are declared."
    },
    {
      "gate_id": 5,
      "verdict": "PASS",
      "summary": "SRVL level is bounded to logical coherence only."
    },
    {
      "gate_id": 11,
      "verdict": "HOLD",
      "summary": "Final verdict is blocked by missing semantic binding."
    }
  ],
  "forbidden_promotion_clean": true,
  "forbidden_promotion_findings": [],
  "redaction_clean": true,
  "redaction_findings": [],
  "required_next_action": "Bind each state to public examples, boundary cases, and rejection cases.",
  "final_verdict": "HOLD_EXACT_BLOCKER"
}
